<?xml version="1.0" encoding="UTF-8"?>
<Type_0x40 messageNo="0" messageSequenceNo="0"
	messageSerialNo="0" xmlns="http://www.example.org/msg_0x40" xmlns:u="http://www.example.org/UType"
	xmlns:xsi="http://www.w3.org/2001/XMLSchema-instance"
	xsi:schemaLocation="http://www.example.org/msg_0x40 ../xsd/msg_0x40.xsd ">
	<UserGroupNo>0</UserGroupNo>
	<UserGroupName>UserGroupName</UserGroupName>
	<Action>0</Action>
	<Users >
		<User>
			<UserType>0</UserType>
			<UserName>UserName</UserName>
		</User>
		<User>
			<UserType>0</UserType>
			<UserName>UserName</UserName>
		</User></Users>
	<MessageSerialNo>00000000</MessageSerialNo>
</Type_0x40>
